Stock Code,Company,Board,Listing Date,Amount Raised (RM),Shares Listed,Listing Price (RM),First Day Closing Price (RM),First Day Closing vs Listing Price Premium / Discount (%),Current Closing Price (RM),First Day Closing Market Capitalisation (RM),Current Closing Market Capitalisation (RM),Current Market Cap vs First Day Closing Market Cap (%),Adviser / managing underwriter
0285,MERCURY SECURITIES GROUP BERHAD,ACE MARKET,19/09/2023,"57,152,000","893,000,000",0.250,0.300,20.00,0.385,"267,900,000","343,805,000",28.33,Public Investment Bank Berhad
0286,EVERGREEN MAX CASH CAPITAL BERHAD,ACE MARKET,26/09/2023,"74,544,000","1,114,902,499",0.240,0.315,31.25,0.360,"351,194,287","401,364,900",14.29,MERCURY SECURITIES SDN BHD
0287,SSF HOME GROUP BERHAD,ACE MARKET,12/10/2023,"56,000,000","800,000,000",0.250,0.265,6.00,0.355,"212,000,000","284,000,000",33.96,M & A SECURITIES SDN BHD
0288,MINOX INTERNATIONAL GROUP BERHAD,ACE MARKET,17/10/2023,"27,000,000","360,000,000",0.250,0.370,48.00,0.245,"133,200,000","88,200,000",-33.78,M & A SECURITIES SDN BHD
0289,PLYTEC HOLDING BERHAD,ACE MARKET,15/11/2023,"55,151,495","606,060,600",0.350,0.325,-7.14,0.315,"196,969,695","190,909,089",-3.08,KAF INVESTMENT BANK BERHAD
0290,PANDA ECO SYSTEM BERHAD,ACE MARKET,27/11/2023,"27,375,488","671,187,000",0.160,0.260,62.50,0.335,"174,508,620","224,847,645",28.85,M & A SECURITIES SDN BHD
5317,CPE TECHNOLOGY BERHAD,MAIN MARKET,07/12/2023,"251,406,879","671,314,791",1.070,0.915,-14.49,1.030,"614,253,034","691,454,235",12.57,KAF Investment Bank Berhad
0291,CRITICAL HOLDINGS BERHAD,ACE MARKET,18/12/2023,"39,032,665","371,739,000",0.350,0.570,62.86,0.850,"211,891,230","315,978,150",49.12,MIDF AMANAH INVESTMENT BANK BERHAD
0292,JATI TINGGI GROUP BERHAD,ACE MARKET,20/12/2023,"27,486,000","391,800,800",0.270,0.310,14.81,0.475,"121,458,248","186,105,380",53.23,TA SECURITIES HOLDINGS BERHAD
0293,KJTS GROUP BERHAD,ACE MARKET,26/01/2024,"58,867,344","688,000,000",0.270,0.500,85.19,0.665,"344,000,000","457,520,000",33.00,Hong Leong Investment bank
0295,MASTER TEC GROUP BERHAD,ACE MARKET,29/01/2024,"111,384,000","1,020,000,000",0.390,0.360,-7.69,1.150,"367,200,000","1,173,000,000",219.44,SJ SECURITIES SDN BHD
0296,HE GROUP BERHAD,ACE MARKET,30/01/2024,"36,649,116","440,000,000",0.280,0.325,16.07,0.580,"143,000,000","255,200,000",78.46,Alliance Islamic bank Berhad
0297,TSA GROUP BERHAD,ACE MARKET,02/02/2024,"42,528,750","309,300,000",0.550,0.575,4.55,0.850,"177,847,500","262,905,000",47.83,AMINVESTMENT BANK BERHAD
0298,WENTEL ENGINEERING HOLDINGS BERHAD,ACE MARKET,06/02/2024,"82,992,000","1,150,000,000",0.260,0.280,7.69,0.315,"322,000,000","362,250,000",12.50,TA SECURITIES HOLDINGS BERHAD
0299,AGX GROUP BERHAD,ACE MARKET,07/02/2024,"44,275,000","432,866,125",0.350,0.360,2.86,0.520,"155,831,805","225,090,385",44.44,TA SECURITIES HOLDINGS BERHAD
0303,ALPHA IVF GROUP BERHAD,ACE MARKET,22/03/2024,"466,560,000","4,860,000,000",0.320,0.320,0.00,0.325,"1,555,200,000","1,579,500,000",1.56,AmInvestment Bank Berhad
5320,PROLINTAS INFRA BUSINESS TRUST,MAIN MARKET,25/03/2024,"445,265,000","1,100,000,000",0.950,0.970,2.11,0.915,"1,067,000,000","1,006,500,000",-5.67,AMINVESTMENT BANK BERHAD
0301,ZANTAT HOLDINGS BERHAD,ACE MARKET,27/03/2024,"18,200,000","280,000,000",0.250,0.375,50.00,0.355,"105,000,000","99,400,000",-5.33,M & A SECURITIES SDN BHD
0300,SBH MARINE HOLDINGS BERHAD,ACE MARKET,08/04/2024,"50,600,000","888,000,000",0.220,0.255,15.91,0.285,"226,440,000","253,080,000",11.76,KAF INVESTMENT BANK BERHAD
5321,KEYFIELD INTERNATIONAL BERHAD,MAIN MARKET,22/04/2024,"188,064,000","800,000,000",0.900,1.930,114.44,2.300,"1,544,000,000","1,846,479,445",19.59,M&A SECURITIES SDN BHD
0302,TOPMIX BERHAD,ACE MARKET,23/04/2024,"31,744,620","393,856,000",0.310,0.420,35.48,0.505,"165,419,520","198,897,280",20.24,M&A SECURITIES SDN BHD
5319,MKH OIL PALM (EAST KALIMANTAN) BERHAD,MAIN MARKET,30/04/2024,"155,438,774","1,023,590,845",0.620,0.615,-0.81,0.550,"629,508,370","562,974,965",-10.57,M & A SECURITIES SDN BHD
0304,FARM PRICE HOLDINGS BERHAD,ACE MARKET,14/05/2024,"32,400,000","450,000,000",0.240,0.410,70.83,0.575,"184,500,000","258,750,000",40.24,ALLIANCE ISLAMIC BANK BERHAD
0305,SIN-KUNG LOGISTICS BERHAD,ACE MARKET,15/05/2024,"39,455,000","1,200,000,000",0.130,0.140,7.69,0.165,"168,000,000","198,000,000",17.86,M & A SECURITIES SDN BHD
5322,FEYTECH HOLDINGS BERHAD,MAIN MARKET,21/05/2024,"202,352,640","843,200,000",0.800,1.100,37.50,0.905,"927,520,000","763,096,000",-17.73,TA SECURITIES HOLDINGS BERHAD
03058,TOTAL DYNAMIC HOLDINGS BERHAD,LEAP MARKET,27/05/2024,"5,009,800","250,000,100",0.200,0.260,30.00,0.275,"65,000,026","68,750,028",5.77,WYNCORP ADVISORY SDN BHD
0306,SMART ASIA CHEMICAL BHD,ACE MARKET,28/05/2024,"37,400,000","369,850,420",0.400,0.460,15.00,0.320,"170,131,193","118,352,134",-30.43,Mercury Securities Sdn Bhd
0307,KAWAN RENERGY BERHAD,ACE MARKET,29/05/2024,"43,350,000","550,000,000",0.300,0.465,55.00,0.650,"255,750,000","357,500,000",39.78,M & A SECURITIES SDN BHD
0308,KTI LANDMARK BERHAD,ACE MARKET,19/06/2024,"61,500,000","800,000,000",0.300,0.285,-5.00,0.250,"228,000,000","200,000,000",-12.28,M & A SECURITIES SDN BHD
0309,AGRICORE CS HOLDINGS BERHAD,ACE MARKET,21/06/2024,"25,857,000","202,800,000",0.500,0.875,75.00,0.545,"177,450,000","110,526,000",-37.71,M & A SECURITIES SDN BHD
0310,UUE HOLDINGS BERHAD,ACE MARKET,02/07/2024,"38,967,600","608,292,000",0.240,0.695,189.58,0.675,"422,762,940","410,597,100",-2.88,M & A SECURITIES SDN BHD
0311,GO HUB CAPITAL BERHAD,ACE MARKET,03/07/2024,"37,513,000","400,000,000",0.350,0.950,171.43,1.430,"380,000,000","572,000,000",50.53,UOB KAY HIAN SECURITIES (M) SDN BHD
0312,OCEAN FRESH BERHAD,ACE MARKET,04/07/2024,"14,014,000","210,146,000",0.280,0.770,175.00,0.385,"161,812,420","80,906,210",-50.00,KAF Investment Bank Berhad
5323,JOHOR PLANTATIONS GROUP BERHAD,MAIN MARKET,09/07/2024,"735,000,000","2,500,000,000",0.840,0.900,7.14,0.965,"2,250,000,000","2,412,500,000",7.22,RHB Investment Bank Berhad
0313,BWYS GROUP BERHAD,ACE MARKET,22/07/2024,"78,386,660","1,025,213,000",0.220,0.350,59.09,0.245,"358,824,550","251,177,185",-30.00,M&A SECURITIES SDN BHD
5325,WELL CHIP GROUP BERHAD,MAIN MARKET,23/07/2024,"172,500,000","600,000,000",1.150,1.720,49.57,1.430,"1,032,000,000","858,000,000",-16.86,Kenanga Investment Bank Berhad
0315,KUCINGKO BERHAD,ACE MARKET,26/07/2024,"60,000,000","500,000,000",0.300,0.570,90.00,0.385,"285,000,000","192,500,000",-32.46,KENANGA INVESTMENT BANK BERHAD
0316,SIK CHEONG BERHAD,ACE MARKET,13/08/2024,"23,220,000","266,000,000",0.270,0.360,33.33,0.240,"95,760,000","63,840,000",-33.33,TA SECURITIES HOLDINGS BERHAD
0318,ELRIDGE ENERGY HOLDINGS BERHAD,ACE MARKET,22/08/2024,"203,000,000","2,000,000,000",0.290,0.400,37.93,0.425,"800,000,000","850,000,000",6.25,KAF Investment Bank Berhad
0317,EPB GROUP BERHAD,ACE MARKET,23/08/2024,"62,479,200","372,000,002",0.560,0.620,10.71,0.590,"230,640,001","219,480,001",-4.84,Malacca Securities Sdn Bhd
0319,VETECE HOLDINGS BERHAD,ACE MARKET,28/08/2024,"34,300,000","392,000,000",0.250,0.405,62.00,0.585,"158,760,000","229,320,000",44.44,KENANGA INVESTMENT BANK BERHAD
